root@lamp-ubuntu-s-1vcpu-1gb-tor1-01:~# tcpdump -r 0001.pcap
reading from file 0001.pcap, link-type EN10MB (Ethernet), snapshot length 262144
20:32:23.213782 IP lamp-ubuntu-s-1vcpu-1gb-tor1-01.ssh > 162.243.188.66.26425: Flags [P.], seq 3294443744:3294443808, ack 2658234726, win 501, options [nop,nop,TS val 3602936686 ecr 3308575829], length 64
20:32:23.213858 IP lamp-ubuntu-s-1vcpu-1gb-tor1-01.ssh > 162.243.188.66.26425: Flags [P.], seq 64:144, ack 1, win 501, options [nop,nop,TS val 3602936686 ecr 3308575829], length 80
20:32:23.214040 IP lamp-ubuntu-s-1vcpu-1gb-tor1-01.ssh > 162.243.188.66.26425: Flags [P.], seq 144:368, ack 1, win 501, options [nop,nop,TS val 3602936686 ecr 3308575829], length 224
20:32:23.224211 IP 162.243.188.66.26425 > lamp-ubuntu-s-1vcpu-1gb-tor1-01.ssh: Flags [.], ack 0, win 1924, options [nop,nop,TS val 3308575852 ecr 3602936683], length 0
20:32:23.227155 IP 162.243.188.66.26425 > lamp-ubuntu-s-1vcpu-1gb-tor1-01.ssh: Flags [.], ack 64, win 1924, options [nop,nop,TS val 3308575855 ecr 3602936686], length 0
20:32:23.227219 IP 162.243.188.66.26425 > lamp-ubuntu-s-1vcpu-1gb-tor1-01.ssh: Flags [.], ack 144, win 1924, options [nop,nop,TS val 3308575856 ecr 3602936686], length 0
20:32:23.227219 IP 162.243.188.66.26425 > lamp-ubuntu-s-1vcpu-1gb-tor1-01.ssh: Flags [.], ack 368, win 1924, options [nop,nop,TS val 3308575856 ecr 3602936686], length 0
20:32:24.402527 IP lamp-ubuntu-s-1vcpu-1gb-tor1-01.ssh > 218.92.0.154.21632: Flags [P.], seq 2810408069:2810408149, ack 3389430673, win 503, options [nop,nop,TS val 3115848399 ecr 1324693104], length 80
20:32:24.609751 IP 218.92.0.154.21632 > lamp-ubuntu-s-1vcpu-1gb-tor1-01.ssh: Flags [P.], seq 1:97, ack 80, win 263, options [nop,nop,TS val 1324693999 ecr 3115848399], length 96
20:32:24.609815 IP lamp-ubuntu-s-1vcpu-1gb-tor1-01.ssh > 218.92.0.154.21632: Flags [.], ack 97, win 503, options [nop,nop,TS val 3115848606 ecr 1324693999], length 0
20:32:24.609867 IP 218.92.0.154.21632 > lamp-ubuntu-s-1vcpu-1gb-tor1-01.ssh: Flags [P.], seq 1:97, ack 80, win 263, options [nop,nop,TS val 1324693999 ecr 3115848399], length 96
20:32:24.609877 IP lamp-ubuntu-s-1vcpu-1gb-tor1-01.ssh > 218.92.0.154.21632: Flags [.], ack 97, win 503, options [nop,nop,TS val 3115848606 ecr 1324693999,nop,nop,sack 1 {1:97}], length 0
20:32:25.895436 IP 188.166.71.137.54688 > lamp-ubuntu-s-1vcpu-1gb-tor1-01.ssh: Flags [S], seq 2008140063, win 64240, options [mss 1460,sackOK,TS val 2286245055 ecr 0,nop,wscale 7], length 0
20:32:25.895515 IP lamp-ubuntu-s-1vcpu-1gb-tor1-01 > 188.166.71.137: ICMP lamp-ubuntu-s-1vcpu-1gb-tor1-01 tcp port ssh unreachable, length 68
20:32:27.982713 IP lamp-ubuntu-s-1vcpu-1gb-tor1-01.ssh > 218.92.0.154.21632: Flags [P.], seq 80:160, ack 97, win 503, options [nop,nop,TS val 3115851979 ecr 1324693999], length 80
20:32:28.189911 IP 218.92.0.154.21632 > lamp-ubuntu-s-1vcpu-1gb-tor1-01.ssh: Flags [P.], seq 97:161, ack 160, win 263, options [nop,nop,TS val 1324694894 ecr 3115851979], length 64
20:32:28.189912 IP 218.92.0.154.21632 > lamp-ubuntu-s-1vcpu-1gb-tor1-01.ssh: Flags [F.], seq 161, ack 160, win 263, options [nop,nop,TS val 1324694894 ecr 3115851979], length 0
20:32:28.189912 IP 218.92.0.154.21632 > lamp-ubuntu-s-1vcpu-1gb-tor1-01.ssh: Flags [P.], seq 97:161, ack 160, win 263, options [nop,nop,TS val 1324694894 ecr 3115851979], length 64
20:32:28.189982 IP lamp-ubuntu-s-1vcpu-1gb-tor1-01.ssh > 218.92.0.154.21632: Flags [.], ack 161, win 503, options [nop,nop,TS val 3115852186 ecr 1324694894], length 0
20:32:28.190029 IP lamp-ubuntu-s-1vcpu-1gb-tor1-01.ssh > 218.92.0.154.21632: Flags [.], ack 162, win 503, options [nop,nop,TS val 3115852186 ecr 1324694894,nop,nop,sack 1 {97:161}], length 0
20:32:28.190057 IP 218.92.0.154.21632 > lamp-ubuntu-s-1vcpu-1gb-tor1-01.ssh: Flags [F.], seq 161, ack 160, win 263, options [nop,nop,TS val 1324694894 ecr 3115851979], length 0
20:32:28.190066 IP lamp-ubuntu-s-1vcpu-1gb-tor1-01.ssh > 218.92.0.154.21632: Flags [.], ack 162, win 503, options [nop,nop,TS val 3115852186 ecr 1324694894,nop,nop,sack 1 {161:162}], length 0
20:32:28.191929 IP lamp-ubuntu-s-1vcpu-1gb-tor1-01.ssh > 218.92.0.154.21632: Flags [F.], seq 160, ack 162, win 503, options [nop,nop,TS val 3115852188 ecr 1324694894], length 0
20:32:28.228115 IP 167.94.138.191.52040 > lamp-ubuntu-s-1vcpu-1gb-tor1-01.ftp: Flags [S], seq 1227496089, win 21900, options [mss 1460,sackOK,TS val 2028157742 ecr 0,nop,wscale 10], length 0
20:32:28.398740 IP 218.92.0.154.21632 > lamp-ubuntu-s-1vcpu-1gb-tor1-01.ssh: Flags [.], ack 161, win 263, options [nop,nop,TS val 1324694946 ecr 3115852188], length 0
20:32:28.398740 IP 218.92.0.154.21632 > lamp-ubuntu-s-1vcpu-1gb-tor1-01.ssh: Flags [.], ack 161, win 263, options [nop,nop,TS val 1324694946 ecr 3115852188], length 0
20:32:28.398835 IP lamp-ubuntu-s-1vcpu-1gb-tor1-01.ssh > 218.92.0.154.21632: Flags [R], seq 2810408230, win 0, length 0
20:32:29.475679 IP 167.94.138.191.43666 > lamp-ubuntu-s-1vcpu-1gb-tor1-01.ftp: Flags [S], seq 3121729177, win 21900, options [mss 1460,sackOK,TS val 2028158990 ecr 0,nop,wscale 10], length 0
20:32:30.541640 IP 167.94.138.191.43666 > lamp-ubuntu-s-1vcpu-1gb-tor1-01.ftp: Flags [S], seq 3121729177, win 21900, options [mss 1460,sackOK,TS val 2028160055 ecr 0,nop,wscale 10], length 0
20:32:30.586117 IP 167.94.138.191.43696 > lamp-ubuntu-s-1vcpu-1gb-tor1-01.ftp: Flags [S], seq 2482439393, win 21900, options [mss 1460,sackOK,TS val 2028160101 ecr 0,nop,wscale 10], length 0
20:32:30.716286 IP inet-research-scan-3.mpi-inf.mpg.de.41558 > lamp-ubuntu-s-1vcpu-1gb-tor1-01.ssh: Flags [F.], seq 1592181433, ack 3009743289, win 501, options [nop,nop,TS val 1816295916 ecr 393132219], length 0
20:32:30.719326 IP lamp-ubuntu-s-1vcpu-1gb-tor1-01.ssh > inet-research-scan-3.mpi-inf.mpg.de.41558: Flags [F.], seq 1, ack 1, win 501, options [nop,nop,TS val 393141633 ecr 1816295916], length 0
20:32:30.831596 IP inet-research-scan-3.mpi-inf.mpg.de.41558 > lamp-ubuntu-s-1vcpu-1gb-tor1-01.ssh: Flags [.], ack 2, win 501, options [nop,nop,TS val 1816296031 ecr 393141633], length 0
20:32:31.499531 IP 188.166.71.137.50522 > lamp-ubuntu-s-1vcpu-1gb-tor1-01.ssh: Flags [S], seq 1166562, win 64240, options [mss 1460,sackOK,TS val 2286250673 ecr 0,nop,wscale 7], length 0
20:32:31.499607 IP lamp-ubuntu-s-1vcpu-1gb-tor1-01 > 188.166.71.137: ICMP lamp-ubuntu-s-1vcpu-1gb-tor1-01 tcp port ssh unreachable, length 68
20:32:31.626723 IP 167.94.138.191.43696 > lamp-ubuntu-s-1vcpu-1gb-tor1-01.ftp: Flags [S], seq 2482439393, win 21900, options [mss 1460,sackOK,TS val 2028161141 ecr 0,nop,wscale 10], length 0
20:32:32.157980 IP 94.232.47.83.48443 > lamp-ubuntu-s-1vcpu-1gb-tor1-01.8888: Flags [S], seq 663388826, win 1025, options [mss 1460], length 0
20:32:34.427647 IP edie.probe.onyphe.net.54377 > lamp-ubuntu-s-1vcpu-1gb-tor1-01.34409: Flags [S], seq 1871058192, win 5840, options [mss 1460,TS val 1145389380 ecr 0,wscale 1,sackOK,eol], length 0
20:32:37.108966 IP 188.166.71.137.50534 > lamp-ubuntu-s-1vcpu-1gb-tor1-01.ssh: Flags [S], seq 1443454587, win 64240, options [mss 1460,sackOK,TS val 2286256282 ecr 0,nop,wscale 7], length 0
20:32:37.109072 IP lamp-ubuntu-s-1vcpu-1gb-tor1-01 > 188.166.71.137: ICMP lamp-ubuntu-s-1vcpu-1gb-tor1-01 tcp port ssh unreachable, length 68
20:32:38.238171 IP 162.243.188.66.26425 > lamp-ubuntu-s-1vcpu-1gb-tor1-01.ssh: Flags [.], ack 368, win 1924, options [nop,nop,TS val 3308590864 ecr 3602936686], length 0
20:32:38.238231 IP lamp-ubuntu-s-1vcpu-1gb-tor1-01.ssh > 162.243.188.66.26425: Flags [.], ack 1, win 501, options [nop,nop,TS val 3602951710 ecr 3308575856], length 0